{
  "$schema": "http://json-schema.org/draft-07/schema#",
  "$id": "https://forge.local/schemas/marker.schema.json",
  "title": "Forge project marker (.claude/.forge.json)",
  "description": "Idempotency marker written by the bootstrap engine into <project>/.claude/.forge.json. Records the Forge version, the chosen profile, the selected modules, the profiler facts pointer, and per-file checksums so updates are checksum-guarded. See docs/BOOTSTRAP.md §Mark.",
  "type": "object",
  "additionalProperties": false,
  "required": ["forgeVersion", "profile", "modules", "generatedAt", "facts", "files"],
  "properties": {
    "forgeVersion": {
      "type": "string",
      "description": "The Forge version that generated this harness (matches forge/VERSION).",
      "minLength": 1
    },
    "profile": {
      "type": "string",
      "description": "The base profile selected by the composer; must be a key in manifests/profiles.json.",
      "minLength": 1
    },
    "modules": {
      "type": "array",
      "description": "The resolved module set (base profile + moduleSelectionRules deltas); each must be a key in manifests/modules.json.",
      "items": {
        "type": "string",
        "minLength": 1
      },
      "minItems": 1,
      "uniqueItems": true
    },
    "generatedAt": {
      "type": "string",
      "description": "ISO 8601 timestamp of when this harness was generated.",
      "format": "date-time"
    },
    "facts": {
      "type": "string",
      "description": "Relative path (within .claude/) to the profiler output that drove composition.",
      "minLength": 1
    },
    "files": {
      "type": "array",
      "description": "Every file Forge generated, with its checksum and whether the user may edit it. Drift between an on-disk checksum and this value marks a file as user-edited and therefore never overwritten on sync.",
      "items": {
        "type": "object",
        "additionalProperties": false,
        "required": ["path", "checksum", "userEditable"],
        "properties": {
          "path": {
            "type": "string",
            "description": "Project-relative path of the generated file.",
            "minLength": 1
          },
          "checksum": {
            "type": "string",
            "description": "Content checksum, prefixed with its algorithm, e.g. \"sha256:…\".",
            "pattern": "^sha256:[0-9a-f]+$"
          },
          "userEditable": {
            "type": "boolean",
            "description": "Whether the user is expected to edit this file (true => protect on sync if checksum drifts)."
          }
        }
      }
    },
    "provenance": {
      "type": "object",
      "description": "Optional provenance block (ADR-0009, BR-FLEET-001/002): records the library Registry schema the harness was tailored against and a deterministic sourceRev folding the contentHash of every resolved component, so the fleet can detect component-level drift. Absent on a legacy marker (version-level drift only). Additive: legacy markers without this block stay valid.",
      "additionalProperties": false,
      "required": ["registrySchema", "sourceRev"],
      "properties": {
        "registrySchema": {
          "type": "string",
          "description": "The on-disk schema tag of the library Registry the harness was resolved against (e.g. \"forge.registry.v1\").",
          "minLength": 1
        },
        "sourceRev": {
          "type": "string",
          "description": "Deterministic sha256 fold over the sorted {uid: contentHash} of the resolved components (order-independent). Format: \"sha256:<hex>\".",
          "pattern": "^sha256:[0-9a-f]+$"
        }
      }
    }
  }
}
